{
  "module": "aadp:relations",
  "version": "1.0",
  "kind": "relation-set",
  "items": [
    {
      "rel": "series",
      "target_type": "series",
      "cardinality": "many",
      "ordered": false,
      "targets": [
        {
          "id": "series:example",
          "url": "https://example.com/ai/v1.0/entities/series/example.json"
        },
        {
          "id": "series:example-2",
          "url": "https://example.com/ai/v1.0/entities/series/example-2.json"
        }
      ]
    }
  ]
}
